{
  "ability_status_items": [],
  "background_items": [],
  "dynamic_state": {
    "as_of": "D3",
    "current_concerns": [],
    "current_conditions": [],
    "current_faction_role": null,
    "current_location_ref": null,
    "current_obligations": [],
    "notes": "没有以历史资料推断 D3 角色专属状态。",
    "source_refs": []
  },
  "evidence_gaps": [
    "特殊梦境未完成，人物后续状态未知。",
    "身体异常的后续结果与稳定人格均未知。"
  ],
  "gap_routing": [
    {
      "gap_id": "GAP_NPC_ZHOU_ZHENG_1",
      "issue": "特殊梦境未完成，人物后续状态未知。",
      "notes": "保持未解决，不由迁移自动填补。",
      "routes": [
        "PROFILE_ONLY"
      ],
      "source_refs": [
        "work/phase3d/approved_candidates/NPC_ZHOU_ZHENG.json"
      ]
    },
    {
      "gap_id": "GAP_NPC_ZHOU_ZHENG_2",
      "issue": "身体异常的后续结果与稳定人格均未知。",
      "notes": "保持未解决，不由迁移自动填补。",
      "routes": [
        "PROFILE_ONLY"
      ],
      "source_refs": [
        "work/phase3d/approved_candidates/NPC_ZHOU_ZHENG.json"
      ]
    }
  ],
  "goals": {
    "current_goals": [],
    "historical_goals": [],
    "long_term_goals": [],
    "private_goals": []
  },
  "human_review_notes": [
    "所有自动迁移结果均为 provisional，需逐项人工批准。"
  ],
  "inputs_considered": [
    {
      "input_class": "old_claims",
      "path": "work/phase3d/approved_candidates/NPC_ZHOU_ZHENG.json",
      "result": "逐项建立 disposition；没有旧档案时为空。"
    },
    {
      "input_class": "direct_temporal_links",
      "path": "work/phase3d_r2b/indexes/by_profile/NPC_ZHOU_ZHENG.json",
      "result": "仅作为 exact-reference lookup，不视为完整历史。"
    },
    {
      "input_class": "indirect_continuity_events",
      "path": "work/phase3d_r2/chronology/campaign_chronology.jsonl",
      "result": "按显式 migration rules 审查间接关键事件。"
    },
    {
      "input_class": "revelations",
      "path": "work/phase3d_r2/chronology/character_revelations.jsonl",
      "result": "保持 attribution 与 evidence status。"
    },
    {
      "input_class": "event_audits",
      "path": "work/phase3d_r2/event_audits/",
      "result": "用于高风险事件语义边界。"
    },
    {
      "input_class": "retention_records",
      "path": "work/phase3d_r2/reports/early_arc_character_retention.md",
      "result": "检查 Part 1 持续影响。"
    },
    {
      "input_class": "discoveries",
      "path": "work/phase3d_r2/character_discoveries/",
      "result": "只创建证据足够的 provisional discovery。"
    },
    {
      "input_class": "d3_state",
      "path": "current_state.md:D3",
      "result": "仅此来源可填 dynamic_state。"
    },
    {
      "input_class": "worldbook_references",
      "path": "output/worldbook_source.jsonl",
      "result": "只辅助稳定身份与架构映射。"
    }
  ],
  "knowledge_items": [],
  "nonactual_projections": [],
  "old_claim_migrations": [
    {
      "destination_ids": [
        "IDENTITY_ZHOU_ZHENG_IDENTITY"
      ],
      "migration_status": "MIGRATED",
      "old_claim_id": "CLAIM_ZHOU_ZHENG_IDENTITY",
      "original_statement": "周正是现代灵异特殊梦境中负责大杭市的驭鬼者。",
      "reason": "R2C explicit section routing; ambiguous chronology remains unresolved rather than inferred.",
      "source_section": "identity.public_identity[0]",
      "supporting_refs": [
        "work/phase3d/approved_candidates/NPC_ZHOU_ZHENG.json"
      ]
    },
    {
      "destination_ids": [
        "CONSTRAINT_ZHOU_ZHENG_EVIDENCE_BOUNDARY"
      ],
      "migration_status": "MIGRATED",
      "old_claim_id": "CONSTRAINT_ZHOU_ZHENG_EVIDENCE_BOUNDARY",
      "original_statement": "仅限特殊梦境番外；不得投射为主世界当前人物或生成主世界关系。",
      "reason": "R2C explicit section routing; ambiguous chronology remains unresolved rather than inferred.",
      "source_section": "rp_constraints[0]",
      "supporting_refs": [
        "work/phase3d/approved_candidates/NPC_ZHOU_ZHENG.json"
      ]
    }
  ],
  "package_status": "PROVISIONAL_REVIEWABLE_DECISION_LAYER",
  "persona": {
    "core_personality": [],
    "decision_patterns": [],
    "motivations": [],
    "speech_style": [],
    "values": []
  },
  "phase": "3D-R2C",
  "presence": {
    "canon_layers": [
      "special_interlude"
    ],
    "life_status": "unknown",
    "narrative_availability": "special_interlude_only",
    "notes": "Profile depth does not force scene presence; inactive, restricted, historical, and interlude boundaries remain operative.",
    "source_refs": [
      "extracted-third/NO.901MurginMunalos，昼短苦夜长，人间正道是沧桑。 - 页 5/posts.md:周正介绍、鬼婴展示与敲门老人交战（lines 586-594, 661-686, 766-847）"
    ],
    "uncertainty": "uncertain"
  },
  "profile_id": "NPC_ZHOU_ZHENG",
  "profile_metadata": {
    "ai_permissions": {
      "may_assign_new_goals": false,
      "may_choose_voluntary_actions": true,
      "may_describe_external_effects": true,
      "may_describe_involuntary_physical_reactions": true,
      "may_generate_dialogue": true,
      "may_generate_private_thoughts": true,
      "may_reference_established_history": true,
      "may_summarize_user_declared_actions": false
    },
    "aliases": [],
    "canon_layers": [
      "special_interlude"
    ],
    "control_mode": "npc_runtime",
    "identity": {
      "durable_affiliations": [],
      "durable_roles": [],
      "public_identity": [
        {
          "attribution": "旧 Profile 中已有来源支持的身份 claim",
          "evidence_mode": "explicit_source_statement",
          "identity_id": "IDENTITY_ZHOU_ZHENG_IDENTITY",
          "notes": "仅保留来源直接支持的范围。",
          "source_refs": [
            "extracted-third/NO.901MurginMunalos，昼短苦夜长，人间正道是沧桑。 - 页 5/posts.md:周正介绍、鬼婴展示与敲门老人交战（lines 586-594, 661-686, 766-847）"
          ],
          "statement": "周正是现代灵异特殊梦境中负责大杭市的驭鬼者。",
          "uncertainty": "confirmed"
        }
      ],
      "species_or_entity": []
    },
    "name": "周正",
    "notes": "Existing effective profile migrated provisionally; not approved or applied.",
    "profile_depth": "compact",
    "profile_kind": "npc",
    "profile_status": "existing",
    "worldbook_id": "CHARACTER_ZHOU_ZHENG",
    "worldbook_mapping_status": "existing"
  },
  "relationship_items": [],
  "rp_constraints": [
    {
      "constraint_id": "CONSTRAINT_ZHOU_ZHENG_EVIDENCE_BOUNDARY",
      "notes": "Construction safety boundary; not a new world fact.",
      "source_refs": [
        "work/phase3c/evidence/NPC_ZHOU_ZHENG_evidence.md"
      ],
      "statement": "仅限特殊梦境番外；不得投射为主世界当前人物或生成主世界关系。"
    }
  ],
  "schema_version": "R2C-MIGRATION-1",
  "source_profile_candidate": "work/phase3d/approved_candidates/NPC_ZHOU_ZHENG.json",
  "timeline_items": [
    {
      "character_consequence": "",
      "character_specific_summary": "角色以“information_source”参与；未完梦境中御临风是无机化学博士生，经 XGA 帖子接触敲门鬼事件并参加灵异研讨会；周正说明鬼与驭鬼者原则，敲门老人入侵后众人逃离；任帆真视角在鬼域走廊开启。",
      "event_ref": "EVENT_INTERLUDE_P3_001_MODERN_GHOST_OPENING",
      "evidence_refs": [
        "extracted-third/NO.901MurginMunalos，昼短苦夜长，人间正道是沧桑。 - 页 5/posts.jsonl post 1334089",
        "extracted-third/NO.901MurginMunalos，昼短苦夜长，人间正道是沧桑。 - 页 5/posts.jsonl post 1334224",
        "extracted-third/NO.901MurginMunalos，昼短苦夜长，人间正道是沧桑。 - 页 5/posts.jsonl post 1334240",
        "extracted-third/NO.901MurginMunalos，昼短苦夜长，人间正道是沧桑。 - 页 5/posts.jsonl post 1334394",
        "extracted-third/NO.901MurginMunalos，昼短苦夜长，人间正道是沧桑。 - 页 5/posts.jsonl post 1334397"
      ],
      "notes": "Exact-reference R2B link reviewed in R2C.",
      "profile_canon_layer": "special_interlude",
      "reality_status": "ACTUAL_EVENT",
      "revelation_refs": [],
      "role_in_event": "information_source",
      "story_order_end": null,
      "story_order_start": "INTERLUDE-P3-001",
      "timeline_id": "TIMELINE_ZHOU_ZHENG_INTERLUDE_P3_001_MODERN_GHOST_OPENING",
      "uncertainty": "confirmed"
    }
  ]
}
